{
  "$schema": "../content-pack.schema.json",
  "packId": "KP-2026-09-24-003",
  "formatVersion": "1.0",
  "createdAt": "2026-09-24T12:05:27+08:00",
  "createdBy": "J-002 (prepared for Jerry review)",
  "sourceRegistryVersion": "SR-2026-09-24-01",
  "status": "NEEDS_REVIEW",
  "review": {
    "reviewedBy": null,
    "reviewedAt": null,
    "decision": null
  },
  "intendedKnowledgeVersion": null,
  "records": [
    {
      "recordId": "KR-2026-016",
      "category": "ASSISTIVE_DEVICE",
      "jurisdiction": "NEW_TAIPEI",
      "title": "新北市身心障礙者輔具費用補助（新北市加碼項目）",
      "source": {
        "sourceId": "SRC-DRIVE-NTPC-AD-TOPUP",
        "authority": "KAREO_DRIVE",
        "url": "https://drive.google.com/file/d/1V_dZRAeeUGYLKR_JrFFUg2g0un4nFmh5/view",
        "fetchedAt": "2026-09-24T12:05:27+08:00",
        "contentHash": "sha256:20ce2c4c1280cbfddf0f82e05064c2844aad0a08b46adcefdb27ce39973e883b"
      },
      "publishedAt": null,
      "effectiveFrom": "2026-09-24",
      "effectiveTo": null,
      "lastVerifiedAt": "2026-09-24T12:05:27+08:00",
      "excerpt": "附表\n新北市政府身心障礙者輔具費用補助基準\n分類 項次 補助項目 最高補助金額\n(單位：新臺幣)\n最低\n使用\n年限\n評估人\n員 補助相關規定\n其他 一\n※人工電子耳\n耗 材 （ 含 長\n線、短線、線\n圈、麥克風及\n磁鐵等項目，\n單 次 補 助 金\n額）\n五千元 二\n醫師診\n斷\n一、首次向新北市政府社會局(以下簡稱本局)申請人工\n電子耳耗材補助者，應檢具醫師開立註明人工電子\n植入日期之診斷書，以證明植入手術已滿三年；再\n申請者得免附診斷書。\n二、各項耗材項目須同批一次提出申請。\n三、十二歲以下兒童補助使用年限為一年。\n其他 二 ※義肢護套 三千元 一 甲\n一、補助對象：\n（一）肢障者。\n（二）具肢障之多重障礙者。\n二、評估規定：應符合下列條件之一：\n（一）經新北市輔具資源中心(以下簡稱輔具中心)開立\n輔具評估報告書。\n（二）相關科別醫師開立診斷證明書註明症狀需要者。\n其他 三\n※特製手搖三\n輪車 一萬元 二 甲\n一、補助對象：\n（一）肢障者。\n（二）具肢障之多重障礙者。\n二、評估規定：應符合下列條件之一：\n（一）經輔具中心開立輔具評估報告書。\n（二）相關科別醫師開立診斷證明書註明症狀需要者。\n其他 四 ※特製滑板 二千元 一 甲\n一、 補助對象：限腦性麻痺患者。\n二、 評估規定：應符合下列條件之一：\n（一）經輔具中心開立輔具評估報告書。\n（二）相關科別醫師開立診斷證明書註明症狀需要者。\n其他 五 ※治療球 一千元 五 甲\n一、 補助對象：限腦性麻痺患者。\n二、 評估規定：應符合下列條件之一：\n（一）經輔具中心開立輔具評估報告書。\n（二）相關科別醫師開立診斷證明書註明症狀需要者。\n其他 六 ※滾筒 一千元 五 甲\n一、 補助對象：限腦性麻痺患者。\n二、 評估規定：應符合下列條件之一：\n（一）經輔具中心開立輔具評估報告書。\n（二）相關科別醫師開立診斷證明書註明症狀需要者。\n其他 七\n※汽車升降機\n改裝 四萬元 五 甲\n一、 補助對象：身心障礙者。\n二、 評估規定：應經輔具中心開立輔具評估報告書。\n三、 其他規定：\n（一）應檢具汽車行照影本（改特製車）。\n（二）應檢具汽車改裝後照片。\n其他 八 非動力樓梯滑\n椅 二萬元 十 甲\n一、補助對象：\n（一）中度以上之肢體障礙者。\n（二）植物人（可坐輪椅者）。\n（三）罕見疾病者（應具備醫生證明須乘坐輪椅）。\n（四）其他無自行上下樓梯能力者。\n二、評估規定：輔具中心開立輔具評估報告書，且實際\n環境適合使用者。\n附註：\n一、輔具補助基準如下：（依據身心障礙者輔具費用補助辦法第二條規定）\n（一）低收入戶：本表「最高補助金額」之全額。\n（二）中低收入戶：本表「最高補助金額」之百分之七十五。\n（三）一般戶：本表「最高補助金額」之百分之五十。\n二、本表之「補助項目」前加註「※」者，低收入戶、中低收入戶、一般戶均可接受「最高補助金額」之全額補助。\n三、補助款之核撥，應按實際購買金額為之，並以本附註一、二所定最高補助金額為限。\n四、「評估人員」之資格，依「身心障礙者服務人員資格訓練及管理辦法」之規定。\n五、申請下列輔具者，應檢具申請人實際使用之照片一張：\n（一）輪椅B 款且附加功能。\n（二）輪椅 C 款。\n（三）高活動型輪椅。\n（四）擺位椅 ABC 款。\n（五）居家無障礙設施改裝。\n（六）電動輪椅。\n（七）電動代步車。\n（八）特製機車∕機車改裝。\n（九）汽車改裝－油門煞車連桿。\n（十）汽車升降機改裝。",
      "summary": "新北市身心障礙者另有地方加碼的輔具補助項目，例如人工電子耳耗材最高 5,000 元、義肢護套 3,000 元、特製手搖三輪車 10,000 元、汽車升降機改裝 40,000 元、非動力樓梯滑椅 20,000 元（腦性麻痺者另有特製滑板、治療球、滾筒）。多數項目需新北市輔具資源中心評估或醫師診斷證明；補助依實際購買金額、以上限為準。此為身心障礙福利，須領有身心障礙證明，與長照輔具給付分開申請。",
      "ruleData": {
        "type": "LOCAL_DISABILITY_AD_TOPUP",
        "city": "新北市",
        "requiresDisabilityCertificate": true,
        "items": [
          {
            "name": "人工電子耳耗材",
            "maxAmount": 5000,
            "minUseYears": 2,
            "fullAmountAllIncome": true
          },
          {
            "name": "義肢護套",
            "maxAmount": 3000,
            "minUseYears": 1,
            "fullAmountAllIncome": true
          },
          {
            "name": "特製手搖三輪車",
            "maxAmount": 10000,
            "minUseYears": 2,
            "fullAmountAllIncome": true
          },
          {
            "name": "特製滑板",
            "maxAmount": 2000,
            "minUseYears": 1,
            "fullAmountAllIncome": true,
            "eligibility": "腦性麻痺"
          },
          {
            "name": "治療球",
            "maxAmount": 1000,
            "minUseYears": 5,
            "fullAmountAllIncome": true,
            "eligibility": "腦性麻痺"
          },
          {
            "name": "滾筒",
            "maxAmount": 1000,
            "minUseYears": 5,
            "fullAmountAllIncome": true,
            "eligibility": "腦性麻痺"
          },
          {
            "name": "汽車升降機改裝",
            "maxAmount": 40000,
            "minUseYears": 5,
            "fullAmountAllIncome": true
          },
          {
            "name": "非動力樓梯滑椅",
            "maxAmount": 20000,
            "minUseYears": 10,
            "fullAmountAllIncome": false
          }
        ],
        "incomeShareOfMax": {
          "LOW_INCOME": 1.0,
          "MIDDLE_LOW_INCOME": 0.75,
          "GENERAL": 0.5
        },
        "assessmentCenter": "新北市輔具資源中心",
        "issuer": "新北市政府社會局"
      },
      "status": "APPROVED",
      "review": {
        "reviewedBy": "Jerry",
        "reviewedAt": "2026-09-24T16:05:40+08:00",
        "decision": "APPROVED",
        "notes": "來源為 Jerry 指定資料夾（D-15）檔案；文件未標示公告日、生效日或版次，effectiveFrom 以擷取日表示，需 Jerry 確認仍為現行版本。身心障礙福利（依身心障礙者輔具費用補助辦法），非長照給付；Assessment 未收集身心障礙證明，結果頁需說明資格條件。附註：標「※」者各身分別均補全額；非動力樓梯滑椅未標「※」，依身分別補 100%／75%／50%。 Jerry 2026-09-24 核准（文件無日期照原文接受）。"
      }
    },
    {
      "recordId": "KR-2026-017",
      "category": "HOME_MEDICAL_NURSING",
      "jurisdiction": "NEW_TAIPEI",
      "title": "新北市身心障礙者醫療輔具補助（呼吸類等）",
      "source": {
        "sourceId": "SRC-DRIVE-NTPC-MED-AD",
        "authority": "KAREO_DRIVE",
        "url": "https://drive.google.com/file/d/1kl8JtMUNozsWeKxKzjBEG2bm_29R_690/view",
        "fetchedAt": "2026-09-24T12:05:27+08:00",
        "contentHash": "sha256:a7b9fda434ac2410ba641f3417be659e15de74c464723efede88b2aabdaa656a"
      },
      "publishedAt": null,
      "effectiveFrom": "2026-09-24",
      "effectiveTo": null,
      "lastVerifiedAt": "2026-09-24T12:05:27+08:00",
      "excerpt": "新北市身心障礙醫療費用及醫療輔具補助標準表\n102.03.13修\n編\n碼\n補助項目 低收入戶\n最高補助\n金額(元)\n中低收\n入戶最\n高補助\n金額\n(元)\n非低收\n入戶及\n非中低\n收入戶\n最高補\n助金額\n(元)\n最低\n使用\n年限\n(年)\n補助相關規定\n1 電動拍痰\n器\n15,000 11,300 7,500 三\n…\n2 抽痰機 5,000 3,800 2,500 三\n…\n3 化痰機(噴\n霧器)\n5,000 3,800 2,500 三\n…\n120,000 90,000 60,000 五\n…\n40,000 30,000 20,000 五\n…\n6 血氧偵測\n儀(血氧\n機)\n6,000 4,500 3,000 三\n…\n7 氧氣製造\n機\n25,000 18,800 12,500 五\n…\n8 氧氣筒 5,000 3,800 2,500 五\n…\n9 UPS不斷電\n系統\n2,500 1,900 1,300 三\n…（壓力衣、矽膠片、人工電子耳植入手術、診斷證明與評估報告費用等項目略）\n備註:\n1. 醫療輔具評估，應由直轄市、縣(市)政府指定之評估單位或鑑定機構為之；申請\n人因特殊情況，於評估單位或鑑定機構進行評估顯有困難者，得由直轄市、縣(市)\n政府指定之評估單位或鑑定機構至居住地進行鑑定或評估。\n2. 醫療輔具與生活輔具合併計算，每人每二年依實際需要，以補助四項為原則；醫\n療輔具使用尚未達最低使用年限或申請項目二年已逾四項，及未符上開補助資格而\n確有使用輔具之需求者，得由直轄市、縣(市)政府專案補助之。\n3. 本表之診斷證明書須為三個月內所開立。\n4. 本表輔具編碼1至6項保固書應載明產品規格：含本標準所定本項輔具之規格或功\n能規範內容)、型號、序號、保固年限及起迄日期(含年、月、日)、輔具供應商行號\n名稱與統一編號及負責人姓名、服務電話，並應標示經中央主管機關醫療器材查驗\n合格之登記字號。\n5. 本表輔具編碼7至17項保固書應載明產品規格：含本標準所定本項輔具之規格或\n功能規範內容)、保固年限(不得低於三個月)及起迄日期(含年、月、日)、輔具供應\n商行號名稱與統一編號及負責人姓名、服務電話。\n6. 租賃契約書應載明規格(含本標準所定本項輔具之規格或功能規範內容)、型號、\n序號、服務內容、租賃起迄日期(含年、月、日)、輔具供應商行號名稱與統一編號\n及負責人姓名、服務電話，並應標示經中央主管機關醫療器材查驗合格之登記字號。\n7. 本表所定低收入戶及中低收入戶，依社會救助法之規定。\n8. 本表之醫療費用補助，以現金給付為原則。",
      "summary": "新北市身心障礙者居家使用的醫療輔具可申請補助，依身分別有不同上限，例如電動拍痰器 15,000／11,300／7,500 元（低收／中低收／一般）、氧氣製造機 25,000／18,800／12,500 元、雙相陽壓呼吸輔助器 120,000／90,000／60,000 元。需三個月內的專科醫師診斷證明，部分項目另需醫療輔具評估報告；醫療輔具與生活輔具合併每人每二年以補助四項為原則。",
      "ruleData": {
        "type": "LOCAL_MEDICAL_DEVICE_SUBSIDY",
        "city": "新北市",
        "requiresDisabilityCertificate": true,
        "version": "102.03.13修",
        "maxAmountByIncome": {
          "電動拍痰器": [
            15000,
            11300,
            7500
          ],
          "抽痰機": [
            5000,
            3800,
            2500
          ],
          "化痰機（噴霧器）": [
            5000,
            3800,
            2500
          ],
          "雙相陽壓呼吸輔助器（Bi-PAP）": [
            120000,
            90000,
            60000
          ],
          "單相陽壓呼吸器（C-PAP）": [
            40000,
            30000,
            20000
          ],
          "血氧偵測儀": [
            6000,
            4500,
            3000
          ],
          "氧氣製造機": [
            25000,
            18800,
            12500
          ],
          "氧氣筒": [
            5000,
            3800,
            2500
          ],
          "UPS 不斷電系統": [
            2500,
            1900,
            1300
          ]
        },
        "incomeOrder": [
          "LOW_INCOME",
          "MIDDLE_LOW_INCOME",
          "GENERAL"
        ],
        "diagnosisValidMonths": 3,
        "maxItemsPerTwoYears": 4,
        "issuer": "新北市政府"
      },
      "status": "NEEDS_REVIEW",
      "review": {
        "reviewedBy": null,
        "reviewedAt": null,
        "decision": null,
        "notes": "來源為 Jerry 指定資料夾（D-15）檔案。**文件標示「102.03.13修」（2013 年）**，需 Jerry 確認是否仍為新北市現行標準；若已修訂，應退回。excerpt 只節錄前 9 項與備註（壓力衣、矽膠片等項目略）。身心障礙福利，非長照給付。 2026-09-24 查核：已被中央「身心障礙者醫療復健費用及醫療輔具補助辦法」附表（111-01-01 施行）取代，建議 REJECTED，改用 KP-2026-09-24-004 KR-2026-018；待 Jerry 決定。"
      }
    }
  ]
}
